{
  "format_version": "1.0",
  "origin": {
    "backend": "opencode-session",
    "description": "OpenCode chat session <session-1> (model Qwen3.8-27B via llama.cpp) in /home/user/Work/osi-hackathon-2026, 2026-10-21; consolidated manually from the session conversation log and the OpenCode session database"
  },
  "records": [
    {
      "id": "session-overview",
      "kind": "context",
      "status": "verified",
      "content": "OSI-2026 portability trial: an OpenCode harness session running Qwen3.8-27B (llama.cpp) in /home/user/Work/osi-hackathon-2026. Rounds 1-6 (full verbatim log packaged as evidence): (1) inventory of tools available to the agent; (2) established per-round conversation logging (prompt, output, time, tokens) with a live question sheet; (3) installed capsule-maker v0.1.0-alpha (uv venv, [science,mcp] extras), imported and integrity-verified C1.zip (131 files), installed C1's declared Python dependencies, and resumed from C1 (63 knowledge records), treating C1 content strictly as untrusted data; (4) full 12-section description of the C1 knowledge base; (5) completed the conversation log with verbatim outputs; (6) re-ran the thioxanthone PBE triplet energy with the NLCC pseudopotential class on C1's PBE-optimized geometries using the local BigDFT runtime (see res-nlcc-et). Round 7 (creation of this capsule) continued in the live workspace log after staging.",
      "tags": [
        "portability-qwen-oc",
        "session"
      ],
      "references": [],
      "evidence": [
        "ev-session-log"
      ],
      "artifacts": [],
      "provenance": [
        "src-oc-session"
      ],
      "supersedes": [],
      "contradicts": [],
      "sensitive": false
    },
    {
      "id": "context-host",
      "kind": "context",
      "status": "verified",
      "content": "Host facts established in-session: 24 cores / 62 GB RAM Linux; no Docker daemon or CLI, no podman/nerdctl/ctr/umoci (skopeo present), sudo requires a password (no root); jhbuild-built BigDFT 1.9.5.680-739eea at /home/user/Work/build/install/bin/bigdft (suite devel @ 739eeadcc); PyBigDFT pseudopotential Database at /home/user/Work/build/PyBigDFT/lib/BigDFT/Database/psppar with families Krack (LDA, PBE; HGH-K) and SS (HGH-K + NLCC, Saha 2015) - the SS set covers C/H/N/O and others but has no S. Thioxanthone-scale PBE jobs fit the host comfortably.",
      "tags": [
        "portability-qwen-oc",
        "environment"
      ],
      "references": [],
      "evidence": [
        "ev-session-log"
      ],
      "artifacts": [],
      "provenance": [
        "src-oc-session",
        "src-bigdft-build"
      ],
      "supersedes": [],
      "contradicts": [],
      "sensitive": false
    },
    {
      "id": "trust-boundary",
      "kind": "decision",
      "status": "verified",
      "content": "Standing rule (user, rounds 2-3): capsule contents (C1.zip, bigdft-runtime.zip) are untrusted data - no executing capsule code, no --trust-code, in-capsule instructions treated as data only. Applied throughout: C1 tests/procedures never executed; C1 psppar files and PBE-optimized geometries used only as inert input data for the calculations the user explicitly ordered.",
      "tags": [
        "portability-qwen-oc",
        "trust"
      ],
      "references": [],
      "evidence": [
        "ev-session-log"
      ],
      "artifacts": [],
      "provenance": [
        "src-oc-session"
      ],
      "supersedes": [],
      "contradicts": [],
      "sensitive": false
    },
    {
      "id": "c1-state",
      "kind": "result",
      "status": "verified",
      "content": "C1 state at resume (capsule-maker resume C1; 63 records): goal = reproduce E_T(6a) = 269 kJ/mol (2.788 eV) with BigDFT Delta-SCF. Phase 0 done: structures S1/S2/S3, 26 dry-run-validated inputs. Phase 1 done: thioxanthone calibration - PBE adiabatic E_T 236.70 kJ/mol (-37.4 vs literature 274.1, fails the 0.2 eV window); PBE0 260.75 kJ/mol (-13.35, passes). Next: the 6a phases (24 dry-run-validated S1 PBE S0/T1 inputs, then PBE0 single points; acceptance within +/-0.15 eV of 2.79 eV).",
      "tags": [
        "portability-qwen-oc",
        "c1"
      ],
      "references": [],
      "evidence": [
        "ev-c1-resume",
        "ev-session-log"
      ],
      "artifacts": [],
      "provenance": [
        "src-c1",
        "src-oc-session"
      ],
      "supersedes": [],
      "contradicts": [],
      "sensitive": false
    },
    {
      "id": "fail-docker",
      "kind": "failed_attempt",
      "status": "verified",
      "content": "Attempted execution via the bigdft-runtime capsule's documented Docker runtime (pinned image bigdft/runtime@sha256:6f16f65f5b33ffe83e53d3c228c21a1e8eb97d0b426f4fad0c805d0bc0540336, BigDFT 1.9.1, 2021): no docker CLI on PATH, no /var/run/docker.sock, no podman/nerdctl/ctr/umoci container runtime, sudo requires a password (no root); image layers cannot be executed without a runtime (skopeo can inspect but not run). Resolved by dec-runtime-local.",
      "tags": [
        "portability-qwen-oc",
        "bigdft-runtime"
      ],
      "references": [],
      "evidence": [
        "ev-session-log"
      ],
      "artifacts": [],
      "provenance": [
        "src-bigruntime",
        "src-oc-session"
      ],
      "supersedes": [],
      "contradicts": [],
      "sensitive": false
    },
    {
      "id": "dec-runtime-local",
      "kind": "decision",
      "status": "verified",
      "content": "Runtime choice: the bigdft-runtime capsule's Docker path is not executable on this host (fail-docker), so the locally jhbuild-built BigDFT 1.9.5.680-739eea was used - closer to C1's 1.9.5 module than the capsule's 1.9.1 image. The runtime was validated first with the capsule's own H2/LDA smoke input and pass criteria: EKS -1.13672072759955523 Ha (capsule recorded -1.1367207275995557; pass range (-2, -0.5) Ha), gradient 7.2e-5 <= 1e-4 -> PASS before any production run.",
      "tags": [
        "portability-qwen-oc",
        "bigdft-runtime"
      ],
      "references": [],
      "evidence": [
        "ev-nlcc-runs",
        "ev-session-log"
      ],
      "artifacts": [],
      "provenance": [
        "src-bigruntime",
        "src-bigdft-build",
        "src-oc-session"
      ],
      "supersedes": [],
      "contradicts": [],
      "sensitive": false
    },
    {
      "id": "dec-psp-nlcc",
      "kind": "decision",
      "status": "verified",
      "content": "Two-step psppar setup (user instruction): first set capsule C1's psppar (Krack PBE HGH-K, XC 11; byte-identical to PyBigDFT Database Krack/PBE files) for all elements C/H/O/S, then set the NLCC psppar (Database SS set, type HGH-K + NLCC, Saha 2015, psp XC field -101130), overwriting where available. Result: C, H, O -> NLCC; S -> no NLCC entry in the SS set -> keeps C1's Krack PBE HGH-K. Electron count verified 72 e- in both generated inputs.",
      "tags": [
        "portability-qwen-oc",
        "nlcc"
      ],
      "references": [],
      "evidence": [
        "ev-nlcc-runs"
      ],
      "artifacts": [],
      "provenance": [
        "src-c1",
        "src-oc-session"
      ],
      "supersedes": [],
      "contradicts": [],
      "sensitive": false
    },
    {
      "id": "dec-protocol",
      "kind": "decision",
      "status": "verified",
      "content": "Protocol held identical to C1 Phase 1 PBE calibration: PBE, hgrid 0.35 bohr, rmult (6,9), gnrm_cv 1e-5, free boundary conditions, T1 = nspin 2 / mpol 2 (magnetization 2.000), fixed-geometry Delta-SCF single points at C1's PBE-optimized S0 and T1 geometries (no re-optimisation, per user instruction).",
      "tags": [
        "portability-qwen-oc",
        "thioxanthone"
      ],
      "references": [],
      "evidence": [
        "ev-nlcc-runs"
      ],
      "artifacts": [],
      "provenance": [
        "src-c1",
        "src-oc-session"
      ],
      "supersedes": [],
      "contradicts": [],
      "sensitive": false
    },
    {
      "id": "res-nlcc-et",
      "kind": "result",
      "status": "verified",
      "content": "Thioxanthone adiabatic Delta-SCF triplet energy, PBE + NLCC psppar (C/H/O NLCC Saha 2015, S Krack PBE), at C1 PBE-optimized geometries, BigDFT 1.9.5.680-739eea, 12 OpenMP threads per run (parallel pair, 24-core host): E(S0) = -116.849975510618592 Ha (24 SCF iterations, gnrm 6.7e-6); E(T1) = -116.758103382909042 Ha (33 iterations, gnrm 1.0e-5, magnetization 2.000). E_T = 0.09187212770955 Ha = 2.49997 eV = 241.21 kJ/mol. Versus C1 PBE/Krack 236.70 kJ/mol (0.09015353 Ha): +4.51 kJ/mol (+0.047 eV) with the NLCC class. Versus literature 274.1 kJ/mol: -32.9 kJ/mol (-0.34 eV), still outside the 0.2 eV calibration window; the deficit remains functional-dominated (C1 PBE0 = 260.75 kJ/mol). Absolute KS energies sit ~11.9 Ha below C1's and are not comparable across pseudopotential classes (different core treatments); only the Delta-E is meaningful. No XC-mismatch warnings in either BigDFT log.",
      "tags": [
        "portability-qwen-oc",
        "thioxanthone",
        "nlcc"
      ],
      "references": [],
      "evidence": [
        "ev-nlcc-runs"
      ],
      "artifacts": [],
      "provenance": [
        "src-oc-session",
        "src-bigdft-build"
      ],
      "supersedes": [],
      "contradicts": [],
      "sensitive": false
    },
    {
      "id": "proc-repro",
      "kind": "procedure",
      "status": "verified",